IA Control,CCI,SRGID,STIGID,SRG Requirement,Requirement,SRG VulDiscussion,VulDiscussion,Status,SRG Check,Check,SRG Fix,Fix,Severity,Mitigation,Artifact Description,Status Justification
SC-5,CCI-002385,SRG-APP-000435-CTR-001070,,The container platform must protect against or limit the effects of all types of denial-of-service (DoS) attacks by employing organization-defined security safeguards.,"Prisma Cloud Compute Container, Image and Host compliance “DISA STIG” policies must be configured","DoS is a condition when a resource is not available for legitimate users. When this occurs, the organization either cannot accomplish its mission or must operate at degraded capacity.

This requirement addresses the configuration of the container platform to mitigate the impact of DoS attacks that have occurred. For each container platform component, known and potential DoS attacks must be identified and solutions for each type implemented. A variety of technologies exist to limit or, in some cases, eliminate the effects of DoS attacks (e.g., limiting runtime processes or restricting the number of sessions the container platform runtime open, limiting container resources to memory and CPU).

Processes are an important indicator of security-and operations-relevant container activity. Process names and their arguments provide important visibility into a container’s activity. If an image includes non-default aliases or renamed binaries, attackers will still attempt to use well-known names.

The same malicious or unwanted activity might affect multiple deployments across different applications or environments. Staff investigating a potential incident need to find those exposures quickly.",Consistent application of policy can minimized the effects of a Denial of Service attack.,Applicable - Configurable,"Review documentation and configuration to determine if the container platform can protect against or limit the effects of all types of DoS attacks by employing defined security safeguards against resource depletion. Examples of resource limits are on memory, storage, and CPU. 

If the container platform cannot be configured to protect against or limit the effects of all types of DoS, this is a finding.","Navigate to Prisma Cloud Compute Console’s -Defend -Compliance -Container and Images the rule “Default - alert on critical and high” is enabled

Navigate to Prisma Cloud Compute Console’s -Defend -Compliance -Hosts the rule “Default - alert on critical and high” is enabled

If these policies are not enabled and/or note scoped to all resources this is a finding","Configure the container platform to protect against or limit the effects of all types of DoS attacks by employing defined security safeguards. Safeguards such as resource limits on memory, storage, and CPU can be used.","Enable and scope Prisma Cloud Compute Console’s -Defend -Compliance -Container and Images the rule “Default - alert on critical and high”

Enable and scope Prisma Cloud Compute Console’s -Defend -Compliance -Hosts the rule “Default - alert on critical and high” ",CAT II,,https://docs.twistlock.com/docs/compute_edition/compliance/manage_compliance.html,"This could be a really big answer. I think as part of this STIG definition there should be a “default STIG compliance” policy rule for Containers/Images and Hosts.

Look in the Console’s Defend -Compliance -Containers/Images & Hosts. Note there is a “default” policy that the product ships enabled. I think a specific “STIG” check would be to ensure that default policy is configured properly."
SC-8 (2),CCI-002420,SRG-APP-000441-CTR-001090,,The container platform must maintain the confidentiality and integrity of information during preparation for transmission.,Prisma Cloud Compute Console to Defender communications is a mutual-TLS authenticated secure web socket session.,"Information may be unintentionally or maliciously disclosed or modified during preparation for transmission within the container platform during aggregation, at protocol transformation points, and during container image runtime. These unauthorized disclosures or modifications compromise the confidentiality or integrity of the information. When transmitting data, the container platform components need to leverage transmission protection mechanisms, such as TLS, TLS VPNs, or IPsec.",The communications between the Prisma Cloud Compute Console and Defender(s) must ensure the confidentiality and integrity of the information to be transported to ensure the integrity and performance of the solution. The data within the Console and Defender containers is within a root-only permission file system location.,Applicable - Inherently Meets,"Review the documentation and deployed configuration to determine if the container platform maintains the confidentiality and integrity of information during preparation before transmission. 

If the confidentiality and integrity are not maintained using mechanisms such as TLS, TLS VPNs, or IPsec during preparation before transmission, this is a finding.",,"Configure the container platform to maintain the confidentiality and integrity of information using mechanisms such as TLS, TLS VPNs, or IPsec during preparation for transmission.",,CAT II,,https://docs.twistlock.com/docs/compute_edition/technology_overviews/defender_architecture.html#defender-console-communication,Runtime protect might be a better fit if the goal is the provide this control to containers running within the environment and not just Prisma Cloud Compute containers - covered in SRG-APP-000447-CTR-001100
SC-8 (2),CCI-002422,SRG-APP-000442-CTR-001095,,The container platform must maintain the confidentiality and integrity of information during reception.,Prisma Cloud Compute Console to Defender communications is a mutual-TLS authenticated secure web socket session.,"Information either can be unintentionally or maliciously disclosed or modified during reception for reception within the container platform during aggregation, at protocol transformation points, and during container image runtime. These unauthorized disclosures or modifications compromise the confidentiality or integrity of the information. When receiving data, the container platform components need to leverage protection mechanisms, such as TLS, TLS VPNs, or IPsec.",The communications between the Prisma Cloud Compute Console and Defender(s) must ensure the confidentiality and integrity of the information during transport to ensure the integrity and performance of the solution.,Applicable - Inherently Meets,"Review documentation and configuration settings to determine if the container platform maintains the confidentiality and integrity of information during reception.

If confidentiality and integrity are not maintained using mechanisms such as TLS, TLS VPNs, or IPsec during reception, this is a finding.",,"Configure the container platform to maintain the confidentiality and integrity using mechanisms such as TLS, TLS VPNs, or IPsec during reception.",,CAT II,,https://docs.twistlock.com/docs/compute_edition/technology_overviews/defender_architecture.html#defender-console-communication,
SI-10 (3),CCI-002754,SRG-APP-000447-CTR-001100,,The container platform must behave in a predictable and documented manner that reflects organizational and system objectives when invalid inputs are received.,Prisma Cloud Compute Runtime  Defense must be enabled,"Software or code parameters typically follow well-defined protocols that use structured messages (i.e., commands or queries) to communicate between software modules or system components. Structured messages can contain raw or unstructured data interspersed with metadata or control information. If attacker-supplied inputs to construct structured messages without properly encoding such messages, then the attacker could insert malicious commands or special characters that can cause the data to be interpreted as control information or metadata.

This requirement guards against adverse or unintended system behavior caused by invalid inputs, where container platform components responses to the invalid input may be disruptive or cause the container image runtime to fail into an unsafe state.

The behavior will be derived from the organizational and system requirements and includes, but is not limited to, notification of the appropriate personnel, creating an audit record, and rejecting invalid input.",Prisma Cloud Compute’s Runtime defense is the set of features that provide both predictive and threat based active protection for running containers. ,Applicable - Configurable,"Review the configuration to determine if the container platform behaves in a predictable and documented manner that reflects organizational and system objectives when invalid inputs are received. 

If the container platform does not meet this requirement, this is a finding.",Navigate to Prisma Cloud Compute Console’s Defend -Runtime and if Enable automatic runtime learning is set to off and/or the Default - alert on suspicious runtime behavior rule is disables and/or not scoped to all this is a finding,Configure the container platform behave in a predictable and documented manner that reflects organizational and system objectives when invalid inputs are received.,Navigate to Prisma Cloud Compute Console’s Defend -Runtime and set Enable automatic runtime learning to on and enable the Default - alert on suspicious runtime behavior rule and scope to all ,CAT II,,https://docs.twistlock.com/docs/compute_edition/runtime_defense/runtime_defense_overview.html,"Automatic runtime learning will model the runtime behaviors (process, filesystem and network) of a container and automatically associate the observed behaviors to the corresponding image. After this process completes (1 hour) any container starting based upon the image will be monitored for the learned “allowed” behaviors. Any process, filesystem call or network behaviors that have not been identified can generate an alert, prevent the action from occurring or terminate the running container"
SI-16,CCI-002824,SRG-APP-000450-CTR-001105,,The container platform must implement organization-defined security safeguards to protect system CPU and memory from resource depletion and unauthorized code execution.,Prisma Cloud Compute Runtime  Defense must be enabled,"The execution of images within the container platform runtime must implement organizational defined security safeguards to prevent distributed denial-of-service (DDOS) and other possible attacks against the container image at runtime.

Security safeguards employed to protect memory and CPU include, for example, data execution prevention and address space layout randomization. Data execution prevention safeguards can be software-enforced. Other means of protection are to limit memory and CPU resources to a container.",Prisma Cloud Compute’s Runtime defense is the set of features that provide both predictive and threat based active protection for running containers. ,Applicable - Configurable,"Review the container platform configuration to determine if safeguards are in place to protect the system memory and CPU from resource depletion and unauthorized execution. 

If safeguards are not in place, this is a finding.",Navigate to Prisma Cloud Compute Console’s Defend -Runtime and if Enable automatic runtime learning is set to off and/or the Default - alert on suspicious runtime behavior rule is disables and/or not scoped to all this is a finding,Configure the container platform to have safeguards in place to protect the system memory and CPU from resource depletion and unauthorized code execution.,Navigate to Prisma Cloud Compute Console’s Defend -Runtime and set Enable automatic runtime learning to on and enable the Default - alert on suspicious runtime behavior rule and scope to all ,CAT II,,https://docs.twistlock.com/docs/compute_edition/runtime_defense/runtime_defense_processes.html,
SI-2 (6),CCI-002617,SRG-APP-000454-CTR-001110,,The container platform must remove old components after updated versions have been installed.,Prisma Cloud Compute must be running the latest release,"Previous versions of container platform components that are not removed from the container platform after updates have been installed may be exploited by adversaries by causing older components to execute which contain vulnerabilities. When these components are deleted, the likelihood of this happening is removed.",Prisma Cloud Compute releases are distributed as docker images. Each release updates or removes components as needed based upon the vulnerabilities associated with the component or the functional need of the component.,Applicable - Configurable,"Review container platform registry documentation and configuration to determine if organization-defined images contains latest approved vendor software image version. 

If organization-defined images do not contain the latest approved vendor software image version, this is a finding. 

Review container platform registry documentation and configuration to determine if organization-defined images are removed after updated versions have been installed. 

If organization-defined images are not removed after updated versions have been installed, this is a finding. 

Review container platform runtime documentation and configuration to determine if organization-define images are executing latest image version from the container platform registry. 

If container platform runtime is not executing latest organization-defined images from the container platform registry, this is a finding.","Navigate to the Prisma Cloud Compute Console, in the top right corner click the bell icon. If there is a newer version this is a finding ",Configure the container platform registry to update organization-defined images with current approved vendor version and remove obsolete images after updated versions have been installed. Configure the container platform runtime to execute latest organization-defined images from the container platform registry.,Upgrade the Prisma Cloud Compute Console and Defenders according to published procedures,CAT II,For Prisma Cloud Compute running in isolated environments version information is posted https://docs.twistlock.com/docs/releases/release-information/latest.html#,https://docs.twistlock.com/docs/compute_edition/upgrade/upgrade_process_self_hosted.html,This is for the updating of Prisma Cloud Compute specifically. Vulnerability rules can be created to help the organization define when an image is not longer allowed based upon the vulnerability posture of the image. https://blog.paloaltonetworks.com/prisma-cloud/continuous-authority-operate/
SI-2 (6),CCI-002617,SRG-APP-000454-CTR-001115,,The container platform registry must remove old container images after updating versions have been made available.,,"Obsolete and stale images need to be removed from the registry to ensure the container platform maintains a secure posture. While the storing of these images does not directly pose a threat, they do increase the likelihood of these images being deployed. Removing stale or obsolete images and only keeping the most recent versions of those that are still in use removes any possibility of vulnerable images being deployed.",,Not Applicable,"Review container platform registry documentation and configuration to determine if organization-defined images contains latest approved vendor software image version. 

If organization-defined images do not contain the latest approved vendor software image version, this is a finding. 

Review container platform registry documentation and configuration to determine if organization-defined images are removed after updated versions have been installed. 

If organization-defined images are not removed after updated versions have been installed, this is a finding. 

Review container platform runtime documentation and configuration to determine if organization-defined images are executing latest image version from the container registry. 

If container platform runtime is not executing latest organization-defined images from the container platform registry, this is a finding.",,Configure the container platform registry to update organization-defined images with current approved vendor version and remove obsolete images after updated versions have been installed. Configure the container platform runtime to execute latest organization-defined images from the container platform registry.,,CAT II,,,Prisma Cloud Compute does not have a container registry feature.
SI-2 c,CCI-002605,SRG-APP-000456-CTR-001125,,"The container platform registry must contain the latest images with most recent updates and execute within the container platform runtime as authorized by IAVM, CTOs, DTMs, and STIGs. ",Prisma Cloud Compute must be configured to scan the organizations container registries,"Software supporting the container platform, images in the registry must stay up to date with the latest patches, service packs, and hot fixes. Not updating the container platform and container images will expose the organization to vulnerabilities.

Flaws discovered during security assessments, continuous monitoring, incident response activities, or information system error handling must also be addressed expeditiously.

Organization-defined time periods for updating security-relevant container platform components may vary based on a variety of factors including, for example, the security category of the information system or the criticality of the update (i.e., severity of the vulnerability related to the discovered flaw).

This requirement will apply to software patch management solutions that are used to install patches across the enclave and to applications themselves that are not part of that patch management solution. For example, many browsers today provide the capability to install their own patch software. Patch criticality, as well as system criticality will vary. Therefore, the tactical situations regarding the patch management process will also vary. This means that the time period utilized must be a configurable parameter. Time frames for application of security-relevant software updates may be dependent upon the Information Assurance Vulnerability Management (IAVM) process.

The container platform components will be configured to check for and install security-relevant software updates within an identified time period from the availability of the update. The container platform registry will ensure the images are current. The specific time period will be defined by an authoritative source (e.g., IAVM, CTOs, DTMs, and STIGs).",Constant scanning of images within an organizations container platform registry will ensure the organization is aware of existing and emerging vulnerabilities within their utilized repositories.,Applicable - Configurable,"Review documentation and configuration to determine if the container platform registry inspects and contains approved vendor repository latest images containing security-relevant updates within a timeframe directed by an authoritative source (IAVM, CTOs, DTMs, STIGs, etc.). 

If the container platform registry does not contain the latest image with security-relevant updates within the time period directed by the authoritative source, this is a finding.

The container platform registry should help the user understand where the code in the environment was deployed from, and must provide controls that prevent deployment from untrusted sources or registries.",Navigate to Prisma Cloud Compute Console’s -Defend -Vulnerabilities -Images -Registry settings if a registry used within the environment is not listed this is a finding,Configure the container platform registry to use approved vendor repository to ensure latest images containing security-relevant updates are installed.,Add the registries used by environment to the Prisma Cloud Compute Console’s -Defend -Vulnerabilities -Images -Registry,CAT II,,https://docs.twistlock.com/docs/compute_edition/vulnerability_management/registry_scanning.html,"The frequency of the scanning of the registry should be a STIG setting in my opinion

https://docs.twistlock.com/docs/compute_edition/configure/configure_scan_intervals.html"
SI-2 c,CCI-002605,SRG-APP-000456-CTR-001130,,"The container platform runtime must have updates installed within the time period directed by an authoritative source (e.g., IAVM, CTOs, DTMs, and STIGs).",Prisma Cloud Compute’s Intelligence Stream must be kept up to date.,"The container platform runtime must be carefully monitored for vulnerabilities, and when problems are detected, they must be remediated quickly. A vulnerable runtime exposes all containers it supports, as well as the host itself, to potentially significant risk. Organizations should use tools to look for Common Vulnerabilities and Exposures (CVEs) vulnerabilities in the runtimes deployed, to upgrade any instances at risk, and to ensure that orchestrators only allow deployments to properly maintained runtimes.",The latest vulnerability and threat information is pulled by the Prisma Cloud Compute Console from the Intelligence Stream (intelligence.twistlock.com). The Prisma Cloud Intelligence Stream provides timely vulnerability data collected and processed from a variety of certified upstream sources. ,Applicable - Configurable,"Review documentation and configuration to determine if the container platform registry inspects and contains approved vendor repository latest images containing security-relevant updates within a timeframe directed by an authoritative source (IAVM, CTOs, DTMs, STIGs, etc.). 

If the container platform registry does not contain the latest image with security-relevant updates within the time period directed by the authoritative source, this is a finding.

The container platform registry should help the user understand where the code in the environment was deployed from and must provide controls that prevent deployment from untrusted sources or registries.",Navigate to Prisma Cloud Compute Console’s -Manage -System -Intelligence if the status is “disconnected” or the last update is over 24 hours old this is a finding,Configure the container platform registry to use approved vendor repository to ensure latest images containing security-relevant updates are installed within the time period directed by the authoritative source.,Configure Prisma Cloud Compute’s Console to either automatically pull Intelligence Stream updates or develop process for the retrieval and distribution of updates.,CAT II,Prisma Cloud Compute ships configured for the Console to attempt connection to public Intelligence Stream endpoint (intelligence.twistlock.com),https://docs.twistlock.com/docs/compute_edition/tools/update_intel_stream_offline.html,Prisma Cloud Compute Intelligence Stream can support large deployments in isolated environments. https://blog.paloaltonetworks.com/prisma-cloud/threat-intelligence-isolated-environments/
