IA Control,CCI,SRGID,STIGID,SRG Requirement,Requirement,SRG VulDiscussion,VulDiscussion,Status,SRG Check,Check,SRG Fix,Fix,Severity,Mitigation,Artifact Description,Status Justification
CM-5 (3),CCI-001749,SRG-APP-000131-CTR-000285,,The container platform must verify container images.,Prisma Cloud Compute images must have their associated SHA-256 digest publicly accessible/ ,"The container platform must be capable of validating container images are signed and that the digital signature is from a recognized and approved source approved by the organization. Allowing any container image to be introduced into the registry and instantiated into a container can allow for services to be introduced that are not trusted and may contain malicious code, which introduces unwanted services. These unwanted services can cause harm and security risks to the hosting server, the container platform, other services running within the container platform, and the overall organization.",Container images are distributive is nature. It is critical to have confidence in what comprises an image before initiating as a container within the runtime environment. Trusting an image is a critical component to microservices.,Applicable - Inherently Meets,"Review the container platform configuration to determine if container images are verified by enforcing image signing and that the image is signed recognized by an approved source. 

If container images are not verified or the signature is not verified as a recognized and approved source, this is a finding.",Pull the Prisma Cloud Compute release tar file from the customer support site. The SHA-256 digest for that release will be posted next to the tar file download. Once the tar is downloaded generate a SHA-256 digest for the file and compare to the release’s published digest. If they do not match this is a finding.,Configure the container platform to verify container images are digitally signed and the signature is from a recognized and approved source.,Contact Palo Alto Networks Customer Support,CAT II,,https://docs.twistlock.com/docs/compute_edition/compliance/trusted_images.html,Similar to Prisma Cloud Compute’s Trusted Images feature. But this is for the trust of each Prisma Cloud Compute release’s images
CM-5 (6),CCI-001499,SRG-APP-000133-CTR-000290,,The container platform must limit privileges to the container platform registry.,The permissions of the container platform registries must be managed according to the organization’s policies and procedures.,"To control what is instantiated within the container platform, it is important to control access to the registry. Without this control, container images can be introduced and instantiated by accident or on container platform startup. Without control of the registry, security measures put in place for the runtime can be bypassed meaning the controls of approval and testing are also bypassed. Only those individuals and roles approved by the organization can have access to the container platform registry.",,Not Applicable,"Review the container platform registry configuration to determine if the level of access to the registry is controlled through user privileges. 

Attempt to perform registry operations to determine if the privileges are enforced. 

If the container platform registry is not limited through user privileges or the user privileges are not enforced, this is a finding.",,Configure the container platform to use and enforce user privileges when accessing the container platform registry.,,CAT II,,,Prisma Cloud Compute does not control the permissions of a container registry
CM-5 (6),CCI-001499,SRG-APP-000133-CTR-000295,,The container platform must limit privileges to the container platform runtime.,The permissions of the container platform runtime must be managed according to the organization’s policies and procedures.,"To control what is instantiated within the container platform, it is important to control access to the runtime. Without this control, container platform specific services and customer services can be introduced without receiving approval and going through proper testing. Only those individuals and roles approved by the organization can have access to the container platform runtime.",,Not Applicable,"Review the container platform runtime configuration to determine if the level of access to the runtime is controlled through user privileges. 

Attempt to perform runtime operations to determine if the privileges are enforced. 

If the container platform runtime is not limited through user privileges or the user privileges are not enforced, this is a finding.",,Configure the container platform to use and enforce user privileges when accessing the container platform runtime.,,CAT II,,"https://docs.twistlock.com/docs/compute_edition/audit/kubernetes_auditing.html

https://docs.twistlock.com/docs/compute_edition/access_control/open_policy_agent.html",Prisma Cloud Compute Kubernetes Auditing and Open Policy Agent features could support this requirement
CM-5 (6),CCI-001499,SRG-APP-000133-CTR-000300,,The container platform must limit privileges to the container platform keystore.,The permissions of the container platform keystone must be managed according to the organization’s policies and procedures.,"The container platform keystore is used to store credentials used to build a trust between the container platform and some external source. This trust relationship is authorized by the organization. If a malicious user were to have access to the container platform keystore, two negative scenarios could develop:

1) Keys not approved could be introduced and 
2) Approved keys deleted, leading to the introduction of container images from sources that were never approved by the organization. 

To thwart this threat, it is important to protect the container platform keystore and give access to only those individuals and roles approved by the organization.",,Not Applicable,"Review the container platform keystore configuration to determine if the level of access to the keystore is controlled through user privileges. 

Attempt to perform keystore operations to determine if the privileges are enforced. 

If the container platform keystore is not limited through user privileges or the user privileges are not enforced, this is a finding.",,Configure the container platform to use and enforce user privileges when accessing the container platform keystore.,,CAT II,,,"Prisma Cloud Compute has a Credential Store, see SRG-APP-000033-CTR-000100 response"
CM-5 (6),CCI-001499,SRG-APP-000133-CTR-000305,,Configuration files for the container platform must be protected.,The configuration integrity of the container platform must be ensured.,The secure configuration of the container platform must be protected by disallowing changes to be implemented by non-privileged users. Changes to the container platform can introduce security risks or stability issues and undermine change management procedures. Securing configuration files from non-privileged user modification can be enforced using file ownership and permissions.,,Not Applicable,"Review the container platform to verify that configuration files cannot be modified by non-privileged users. 

If non-privileged users can modify configuration files, this is a finding.",,Configure the container platform to only allow configuration modifications by privileged users.,,CAT II,,https://docs.twistlock.com/docs/compute_edition/compliance/cis_benchmarks.html,Prisma Cloud Compute Compliance checks could be used by customers to ensure this check. For example application of the Docker Enterprise 2.x Linux/UNIX STIG
CM-5 (6),CCI-001499,SRG-APP-000133-CTR-000310,,Authentication files for the container platform must be protected.,The authentication integrity of the container platform must be ensured.,"The secure configuration of the container platform must be protected by disallowing changing to be implemented by non-privileged users. Changes to the container platform can introduce security risks and stability issues and undermine change management procedures. To secure authentication files from non-privileged user modification can be enforced using file ownership and permissions.

Examples of authentication files are keys, certificates, and tokens.",,Not Applicable,"Review the container platform to verify that authentication files cannot be modified by non-privileged users. 

If non-privileged users can modify key and certificate files, this is a finding.",,Configure the container platform to only allow authentication file modifications by privileged users.,,CAT II,,https://docs.twistlock.com/docs/compute_edition/compliance/cis_benchmarks.html,"Prisma Cloud Compute Compliance checks could be used by customers to ensure this check. For example, Compliance Host check #38 Verify that registry certificate file permissions are set to 444 or more restrictive"
CM-7 a,CCI-000381,SRG-APP-000141-CTR-000315,,The container platform must be configured with only essential configurations.,The configuration integrity of the container platform must be ensured.,"The container platform can be built with components that are not used for the intended purpose of the organization. To limit the attack surface of the container platform, it is essential that the non-essential services are not installed.",,Not Applicable,"Review the container platform configuration and verify that only those components needed for operation are installed. 

If components are installed that are not used for the intended purpose of the organization, this is a finding.",,Identify the role the container platform is intended to play in the production environment and remove any components that are not needed or used for the intended purpose.,,CAT II,,https://docs.twistlock.com/docs/compute_edition/compliance/host_scanning.html,Host based compliance scanning can be used by the organization to ensure the configuration of the environment has not changed
CM-7 a,CCI-000381,SRG-APP-000141-CTR-000320,,The container platform registry must contain only container images for those capabilities being offered by the container platform.,Images stored within the container registry must only contain images to be ran as containers within the container platform.,"Allowing container images to reside within the container platform registry that are not essential to the capabilities being offered by the container platform becomes a potential security risk. By allowing these non-essential container images to exist, the possibility for accidental instantiation exists. The images may be unpatched, not supported, or offer non-approved capabilities. Those images for customer services are considered essential capabilities.",,Not Applicable,"Review the container platform registry and the container images being stored. 

If container images are stored in the registry and are not being used to offer container platform capabilities, this is a finding.",,Remove all container images from the container platform registry that are not being used or contain features and functions not supported by the platform.,,CAT II,,https://docs.twistlock.com/docs/compute_edition/compliance/trusted_images.html,Can use Prisma Cloud Compute’s Trusted Images feature to support this requirement
CM-7 b,CCI-000382,SRG-APP-000142-CTR-000325,,"The container platform runtime must enforce ports, protocols, and services that adhere to the PPSM CAL.",Prisma Cloud Compute communication TCP ports must adhere to the PSSM CAL.,"Ports, protocols, and services within the container platform runtime must be controlled and conform to the PPSM CAL. Those ports, protocols, and services that fall outside the PPSM CAL must be blocked by the runtime. Instructions on the PPSM can be found in DoD Instruction 8551.01 Policy.",Prisma Cloud Compute TCP port usage is configurable. Default configuration: TCP 8081 Console user interface and API (HTTP) - disabled by default TCP 8083 Console user interface and API TLS v1.2 (HTTPS) TCP 8084 Console - to - Defender communication via mutual TLS v1.2 web socket session,Applicable - Configurable,"Review the container platform documentation and deployment configuration to determine which ports and protocols are enabled. 

Verify the ports and protocols being used are not prohibited by PPSM CAL in accordance to DoD Instruction 8551.01 Policy and are necessary for the operations and applications.

If any of the ports or protocols is prohibited or not necessary for the operation, this is a finding.","For Kubneretes deployment type kubectl describe pods <twistlock-console-pod--n <namespace-and verify the MANAGEMENT_PORT_HTTPS, MANAGEMENT_PORT_HTTP & COMMUNICATION_PORT values

If any of the ports do not adhere to the PPSM CAL this is a finding.",Configure the container platform to disable any ports or protocols that are prohibited by the PPSM CAL and not necessary for the operation.,Adjust the TCP port used by Prisma Cloud Compute to adhere to the PPSM CAL.,CAT II,,https://docs.twistlock.com/docs/compute_edition/howto/configure_listening_ports.html#overview,Prisma Cloud Compute Runtime Network policy can be used to enforce container port usage. https://docs.twistlock.com/docs/compute_edition/runtime_defense/runtime_defense_networking.html
CM-7 b,CCI-000382,SRG-APP-000142-CTR-000330,,The container platform runtime must enforce the use of ports that are non-privileged.,Prisma Cloud Compute must use TCP ports above 1024,"Privileged ports are those ports below 1024 and that require system privileges for their use. If containers are able to use these ports, the container must be run as a privileged user. The container platform must stop containers that try to map to these ports directly. Allowing non-privileged ports to be mapped to the container-privileged port is the allowable method when a certain port is needed. An example is mapping port 8080 externally to port 80 in the container.",Prisma Cloud Compute default TCP ports are 8083 (Console UI and API) and 8084 Console  to—Defender communication. To use TCP ports below 1024 the Console would have to be configured to use privileged ports.,Applicable - Configurable,"Review the container platform configuration and the containers within the platform by performing the following checks:

1. Verify the container platform is configured to disallow the use of privileged ports by containers.
2. Validate all containers within the container platform are using non-privileged ports.
3. Attempt to instantiate a container image that uses a privileged port.

If the container platform is not configured to disallow the use of privileged ports, this is a finding.

If the container platform has containers using privileged ports, this is a finding.

If the container platform allows containers to be instantiated that use privileged ports, this is a finding.","For Kubneretes deployment type kubectl describe pods <twistlock-console-pod--n <namespace-and verify the MANAGEMENT_PORT_HTTPS, MANAGEMENT_PORT_HTTP & COMMUNICATION_PORT values

If any of the ports are below 1024 this is a finding",Configure the container platform to disallow the use of privileged ports by containers. Move any containers that are using privileged ports to non-privileged ports.,Adjust the TCP port used by Prisma Cloud Compute to non-privileged ports.,CAT II,,https://docs.twistlock.com/docs/compute_edition/howto/configure_listening_ports.html#overview,
IA-2,CCI-000764,SRG-APP-000148-CTR-000335,,The container platform must uniquely identify and authenticate users.,"All Prisma Cloud Compute users must have a unique, individual account.","The container platform requires user accounts to perform container platform tasks. These tasks may pertain to the overall container platform or may be component-specific, thus requiring users to authenticate against those specific components. To ensure accountability and prevent unauthenticated access, users must be identified and authenticated to prevent potential misuse and compromise of the system.",Prisma Cloud Compute does not have a default account. During installation an administrator is created by the installer. This account can be removed once other accounts have been added.,Applicable - Configurable,"Review the container platform configuration to determine if users are uniquely identified and authenticated. 

If users are not uniquely identified or are not authenticated, this is a finding.",Navigate to Prisma Cloud Compute Manage -Authentication -Users and review that the account are unique for every user. If there are common accounts this is a finding.,Configure the container platform to uniquely identify and authenticate users.,Create accounts for each unique user of Prisma Cloud Compute,CAT II,,https://docs.twistlock.com/docs/compute_edition/authentication/authentication.html,
IA-2,CCI-000764,SRG-APP-000148-CTR-000340,,The container platform application program interface (API) must uniquely identify and authenticate users.,"All Prisma Cloud Compute users must have a unique, individual account to access the API.",The container platform requires user accounts to perform container platform tasks. These tasks are often performed through the container platform API. Protecting the API from users who are not authorized or authenticated is essential to keep the container platform stable. Protection of platform and application data and enhances the protections put in place for Denial-of Service (DoS) attacks.,Access to the Prisma Cloud Compute API requires authentication and authorization is role based.,Applicable - Inherently Meets,"Review the container platform configuration to determine if users are uniquely identified and authenticated before the API is executed. 

If users are not uniquely identified or are not authenticated, this is a finding.",,Configure the container platform to uniquely identify and authenticate users before container platform API access.,,CAT II,,https://docs.twistlock.com/docs/compute_edition/api/access_api.html,
IA-2,CCI-000764,SRG-APP-000148-CTR-000345,,The container platform must uniquely identify and authenticate processes acting on behalf of the users.,Prisma Cloud Compute Console must run as non-root user (uid 2674),"The container platform will instantiate a container image and use the user privileges given to the user used to execute the container. To ensure accountability and prevent unauthenticated access to containers, the user the container is using to execute must be uniquely identified and authenticated to prevent potential misuse and compromise of the system.",Containers not requiring root level permissions should run as a unique user account,Applicable - Configurable,"Review the container platform configuration to determine if processes acting on behalf of users are uniquely identified and authenticated. 

If processes acting on behalf of users are not uniquely identified or are not authenticated, this is a finding.",On the node in which the Prisma Cloud Compute Console container is running determine the process owner for “app/server” (ps -aux | grep “/app/server”) if the process is owned by root this is a finding.,Configure the container platform to uniquely identify and authenticate processes acting on behalf of users.,"	In the root directory of the extracted release tar file, modify the twistlock.cfg file's line RUN_CONSOLE_AS_ROOT=false

	Kubernetes deployment perform these additional steps

	When generating the twistlock_console.yaml deployment file supply the --run-as-user flag

linux/twistcli console export kubernetes --service-type ClusterIP --run-as-user 2674
modify the resulting twistlock_console.yaml file to include fsGroup: 2674 within the Deployment pod specification's securityContext
securityContext: fsGroup: 2674
Add runAsGroup: 2674 to the container specification's securityContext
securityContext: runAsUser: 2674 runAsGroup: 2674
",CAT II,,,The Prisma Cloud Compute Console containers can be configured to run as non-root user (uid 2674)
IA-2,CCI-000764,SRG-APP-000148-CTR-000350,,The container platform application program interface (API) must uniquely identify and authenticate processes acting on behalf of the users.,Prisma Cloud Compute API must require uniquely identifiable user authentication.,"The container platform API can be used to perform any task within the platform. Often, the API is used to create tasks that perform some kind of maintenance task and run without user interaction. To guarantee the task is authorized, it is important to authenticate the task. These tasks, even though executed without user intervention, run on behalf of a user and must run with the user's authorization. If tasks are allowed to be created without authentication, users could bypass authentication and authorization mechanisms put in place for user interfaces. This could lead to users gaining greater access than given to the user putting the container platform into a compromised state.",,Not Applicable,"Review the container platform API configuration to determine if processes acting on behalf of users are uniquely identified and authenticated. 

If processes acting on behalf of users are not uniquely identified or are not authenticated, this is a finding.",,Configure the container platform API to uniquely identify and authenticate processes acting on behalf of users.,,CAT II,,https://docs.twistlock.com/docs/compute_edition/api/access_api.html,All API endpoints require unique Prisma Cloud Compute authentication
IA-2 (1),CCI-000765,SRG-APP-000149-CTR-000355,,The container platform must use multifactor authentication for network access to privileged accounts.,Authentication to Prisma Cloud Compute must use multi-factor authentication,"Without the use of multifactor authentication, the ease of access to privileged functions is greatly increased.

Multifactor authentication requires using two or more factors to achieve authentication.

Factors include: 
(i) something a user knows (e.g., password/PIN); 
(ii) something a user has (e.g., cryptographic identification device, token); or 
(iii) something a user is (e.g., biometric).

A privileged account is defined as an information system account with authorizations of a privileged user.

Network access is defined as access to an information system by a user (or a process acting on behalf of a user) communicating through a network (e.g., local area network, wide area network, or the internet).","Multi-factor authentication is an added measure to ensure a privileged user account is compromised by an unauthorized user.

Prisma Cloud Compute supports direct x.509 (smartcard) multi-factor authentication.

Other forms of multi-factor authentication can be supported through SAML and OpenID Connect identity providers",Applicable - Configurable,"Review the container platform configuration to determine if the container platform is configured to use multifactor authentication for network access to privileged accounts. 

If the container platform does not use multifactor authentication for network access to privileged accounts, this is a finding.","Navigate to Prisma Cloud Compute Console’s Manage -Authentication -Users, x.509 users are local accounts. Ensure that the password to these accounts are complex and unknown to the user. If the user can authenticate with username / password this is a finding.",Configure the container platform to use multifactor authentication for network access to privileged accounts.,"Ensure the local accounts are configured for x.509 authentication. 

SAML and OpenID Connect accounts multi-factor authentication enforcement occurs on the identity provider.",CAT II,,"https://docs.twistlock.com/docs/compute_edition/authentication/oidc.html

https://docs.twistlock.com/docs/compute_edition/authentication/saml.html

https://docs.twistlock.com/docs/compute_edition/configure/authenticate_console_with_certs.html",
