V-69567,high,SRG-APP-000171,SV-84189r1_rule,APSC-DV-001740,The application must only store cryptographic representations of passwords.,"Use of passwords for application authentication is intended only for limited situations and should not be used as a replacement for two-factor CAC-enabled authentication.

Examples of situations where a user ID and password might be used include but are not limited to:

- When the application user base does not have a CAC and is not a current DoD employee, member of the military, or a DoD contractor.

- When an application user has been officially designated as a Temporary Exception User; one who is temporarily unable to present a CAC for some reason (lost, damaged, not yet issued, broken card reader) and to satisfy urgent organizational needs must be temporarily permitted to use user ID/password authentication until the problem with CAC use has been remedied.

and

- When the application is publicly available and or hosting publicly releasable data requiring some degree of need-to-know protection.

Passwords need to be protected at all times and using a strong one-way hashing encryption algorithm with a salt is the standard method for providing a means to validate a user's password without having to store the actual password.  

Performance and time required to access are factors that must be considered and the one way hash is the most feasible means of securing the password and providing an acceptable measure of password security.  If passwords are stored in clear text, they can be plainly read and easily compromised.

In many instances, verifying the user knows a password is performed using a password verifier. In its simplest form, a password verifier is a computational function that is capable of creating a hash of a password and determining if the value provided by the user matches the hash.  

A more secure version of verifying a user knowing a password is to store the result of an iterating hash function and a large random SALT value as follows:

H0 = H(pwd, H(salt))
Hn = H(Hn-1,H(salt))

Where n is a cryptographically-strong random [*3] number. Hn is stored, along with the salt. When the application wishes to verify that the user knows a password, it simply repeats the process and compares Hn with the stored Hn.

A SALT is essentially a fixed-length cryptographically-strong random value.  

Another method used is utilizing a keyed hash message authentication code (HMAC).  HMAC calculates a message authentication code via a cryptographic hash function used in conjunction with an encryption key.  The key must be protected as with any private key.
 
Applications must only store passwords that have been cryptographically protected.",,"Review the application documentation and interview the application administrator to identify if the application uses passwords for user authentication.

If the application does not use passwords, the requirement is not applicable.

Have the application administrator identify the application's password storage locations.  Potential locations include the local file system where the application is stored or in an application-related database table that should not be accessible to application users.

Review application files and folders using a text editor or by using a database tool that allows you to view data stored in database tables.  Look for indications of stored user information and review that information.  Determine if password strings are readable/discernable.

Determine if the application uses the MD5 hashing algorithm to create password hashes.

If the passwords are readable or there is no indication the application utilizes cryptographic hashing to protect passwords, or if the MD5 hash algorithm is used to create password hashes, this is a finding.","Use strong cryptographic hash functions when creating password hash values.

Utilize random salt values when creating the password hash.

Ensure strong access control permissions on data files containing authentication data.",,,false,,,,,,,M,Unclass,"Application Security and Development Security Technical Implementation Guide :: Version 4, Release: 11 Benchmark Date: 24 Jul 2020",3009,"CCI-000196
The information system, for password-based authentication, stores only encrypted representations of passwords.
NIST SP 800-53 :: IA-5 (1) (c)
NIST SP 800-53A :: IA-5 (1).1 (v)
NIST SP 800-53 Revision 4 :: IA-5 (1) (c)",IA-5 (1) (c),,"Prisma Cloud Compute stores local username/password accounts within a local database table using the HMAC256. Username/password authentication can be disabled and authentication can be provided by a 3rd party authentications source (e.g. LDAP, SAML, X.509). Direct X.509 (DoD CAC) authentication is supported."
V-69569,high,SRG-APP-000172,SV-84191r1_rule,APSC-DV-001750,The application must transmit only cryptographically-protected passwords.,"Use of passwords for application authentication is intended only for limited situations and should not be used as a replacement for two-factor CAC-enabled authentication.

Examples of situations where a user ID and password might be used include but are not limited to:

- When the application user base does not have a CAC and is not a current DoD employee, member of the military, or a DoD contractor.

- When an application user has been officially designated as a Temporary Exception User; one who is temporarily unable to present a CAC for some reason (lost, damaged, not yet issued, broken card reader) and to satisfy urgent organizational needs must be temporarily permitted to use user ID/password authentication until the problem with CAC use has been remedied.

and

- When the application is publicly available and or hosting publicly releasable data requiring some degree of need-to-know protection.

Passwords need to be protected at all times and encryption is the standard method for protecting passwords. If passwords are not encrypted, they can be plainly read (i.e., clear text) and easily compromised.

Applications can accomplish this by making direct function calls to encryption modules or by leveraging operating system encryption capabilities.",,"Review the application documentation and interview the application administrator to identify if the application uses passwords for user authentication.

If the application does not use passwords, the requirement is not applicable.

Identify when the application transmits passwords. This will most likely be when the user authenticates to the application or when the application authenticates to another resource.

Access the application management interface with a test account and access the functionality that requires a password be provided. If the interface is via a web browser, verify the web browser has gone secure prior to entering any password or authentication information.

This can be done by viewing the browser and observing a “lock” icon displayed somewhere in the browser as well as an https:// to indicate an SSL connection. Most browsers display this in the upper left hand corner.

If the application is transmitting the password rather than the user, obtain design documentation from the application admin that provides the details on how they are protecting the password during transmission. This will usually be via a TLS/SSL tunneled connection or VPN.

If the passwords are not encrypted when being transmitted, this is a finding.",Configure the application to encrypt passwords when they are being transmitted.,,,false,,,,,,,M,Unclass,"Application Security and Development Security Technical Implementation Guide :: Version 4, Release: 11 Benchmark Date: 24 Jul 2020",3009,"CCI-000197
The information system, for password-based authentication, transmits only encrypted representations of passwords.
NIST SP 800-53 :: IA-5 (1) (c)
NIST SP 800-53A :: IA-5 (1).1 (v)
NIST SP 800-53 Revision 4 :: IA-5 (1) (c)",IA-5 (1) (c),,All communication to the Prisma Cloud Compute Console and API is protected by TLS. https://docs.paloaltonetworks.com/prisma/prisma-cloud/20-04/prisma-cloud-compute-edition-admin/configure/custom_certs_console_access.html
V-70149,high,SRG-APP-000175,SV-84771r1_rule,APSC-DV-001810,"The application, when utilizing PKI-based authentication, must validate certificates by constructing a certification path (which includes status information) to an accepted trust anchor.","Without path validation, an informed trust decision by the relying party cannot be made when presented with any certificate not already explicitly trusted.

A trust anchor is an authoritative entity represented via a public key and associated data. It is used in the context of public key infrastructures, X.509 digital certificates, and DNSSEC.

When there is a chain of trust, usually the top entity to be trusted becomes the trust anchor; it can be, for example, a Certification Authority (CA). A certification path starts with the subject certificate and proceeds through a number of intermediate certificates up to a trusted root certificate, typically issued by a trusted CA.

This requirement verifies that a certification path to an accepted trust anchor is used for certificate validation and that the path includes status information. Path validation is necessary for a relying party to make an informed trust decision when presented with any certificate not already explicitly trusted. Status information for certification paths includes certificate revocation lists or online certificate status protocol responses. Validation of the certificate status information is out of scope for this requirement.",,"Review the application documentation, the application architecture and interview the application administrator to identify the method employed by the application for validating certificates.

Review the method to determine if a certification path that includes status information is constructed when certificate validation occurs.

Some applications may utilize underlying OS certificate validation and certificate path building capabilities while others may build the capability into the application itself.

The certification path will include the intermediary certificate CAs along with a status of the CA server's signing certificate and will end at the trusted root anchor.

If the application does not construct a certificate path to an accepted trust anchor, this is a finding.",Design the application to construct a certification path to an accepted trust anchor when using PKI-based authentication.,,,false,,,,,,,M,Unclass,"Application Security and Development Security Technical Implementation Guide :: Version 4, Release: 11 Benchmark Date: 24 Jul 2020",3009,"CCI-000185
The information system, for PKI-based authentication validates certifications by constructing and verifying a certification path to an accepted trust anchor including checking certificate status information.
NIST SP 800-53 :: IA-5 (2)
NIST SP 800-53A :: IA-5 (2).1
NIST SP 800-53 Revision 4 :: IA-5 (2) (a)",IA-5 (2) (a),,"Direct X.509 (DoD CAC) authentication is supported. PKI chain validation (chain of trust, CRL and OCSP) is performed upon the user’s authentication certificate."
V-70151,high,SRG-APP-000176,SV-84773r1_rule,APSC-DV-001820,"The application, when using PKI-based authentication, must enforce authorized access to the corresponding private key.","If the private key is discovered, an attacker can use the key to authenticate as an authorized user and gain access to the network infrastructure.

The cornerstone of the PKI is the private key used to encrypt or digitally sign information.

If the private key is stolen, this will lead to the compromise of the authentication and non-repudiation gained through PKI because the attacker can use the private key to digitally sign documents and pretend to be the authorized user.

Both the holders of a digital certificate and the issuing authority must protect the computers, storage devices, or whatever they use to keep the private keys.",,"Review the application documentation and interview the application administrator to identify where the application's private key is stored.

If the application does not perform code signing or other cryptographic tasks requiring a private key, this requirement is not applicable.

Ask the administrator to demonstrate where the application private key(s) are stored. Examine access restrictions and ensure access controls are in place to restrict access to the private key(s).

If the key(s) are stored on the file system, ensure adequate file permissions are set so as to only allow authorized users and processes.

If the key(s) are maintained or available via an application interface, ensure the application provides access controls that limit access via the application interface to only authorized users and processes.

Review access controls and attempt to use a relevant user account, group or application role that is not allowed access to the private key.

Verify access to the keys is denied.

If unauthorized access is granted to the private key(s), this is a finding.",Configure the application or relevant access control mechanism to enforce authorized access to the application private key(s).,,,false,,,,,,,M,Unclass,"Application Security and Development Security Technical Implementation Guide :: Version 4, Release: 11 Benchmark Date: 24 Jul 2020",3009,"CCI-000186
The information system, for PKI-based authentication enforces authorized access to the corresponding private key.
NIST SP 800-53 :: IA-5 (2)
NIST SP 800-53A :: IA-5 (2).1
NIST SP 800-53 Revision 4 :: IA-5 (2)",IA-5 (2),,The private X.509 keys used for Console and API TLS transport protection are stored within a file system directory that has permission mask of 600 is owned by root user and group.
V-70157,high,SRG-APP-000178,SV-84779r2_rule,APSC-DV-001850,The application must not display passwords/PINs as clear text.,"To prevent the compromise of authentication information such as passwords during the authentication process, the feedback from the information system must not provide any information that would allow an unauthorized user to compromise the authentication mechanism.

Obfuscation of user-provided information when typed into the system is a method used in addressing this risk.

For example, displaying asterisks when a user types in a password is an example of obscuring feedback of authentication information.

Another method is to display authentication feedback for a very limited time, usually in fractions of a second. This occurs during password character entry where the password characters are displayed for a very small window of time and then automatically obfuscated. This allows users with just enough time to confirm their password as they type it while limiting the ability of ""shoulder surfers"" to covertly witness the values.

A common tactic employed to circumvent password obfuscation is to copy the obfuscated password and paste it to a text file.  Proper obfuscation techniques will not paste the clear text password.",,"Ask the application admin to log on to the application.

Observe the authentication process and verify any display feedback provided when the admin enters her/his password is obfuscated and not clear text.

For applications that display authentication feedback for a very limited time, ensure the feedback time the character is displayed is only momentary i.e., fractions of a second.

Using a text editor, copy the obfuscated password and paste to a text file.  Do not save the file.

If the application displays clear text when the password/PIN is entered, or if the time period for displayed feedback exceeds fractions of a second, or if the clear text password/PIN is displayed when pasted, this is a finding.","Configure the application to obfuscate passwords and PINs when they are being entered so they cannot be read.

Design the application so obfuscated passwords cannot be copied and then pasted as clear text.",,,false,,,,,,,M,Unclass,"Application Security and Development Security Technical Implementation Guide :: Version 4, Release: 11 Benchmark Date: 24 Jul 2020",3009,"CCI-000206
The information system obscures feedback of authentication information during the authentication process to protect the information from possible exploitation/use by unauthorized individuals.
NIST SP 800-53 :: IA-6
NIST SP 800-53A :: IA-6.1
NIST SP 800-53 Revision 4 :: IA-6",IA-6,,The Prisma Cloud Compute UI authentication page obfuscates the password characters that are entered. 
V-70205,high,SRG-APP-000219,SV-84827r1_rule,APSC-DV-002230,The application must not expose session IDs.,"Authenticity protection provides protection against man-in-the-middle attacks/session hijacking and the insertion of false information into sessions.

Application communication sessions are protected utilizing transport encryption protocols, such as SSL or TLS. SSL/TLS provides web applications with a means to be able to authenticate user sessions and encrypt application traffic. Session authentication can be single (one-way) or mutual (two-way) in nature. Single authentication authenticates the server for the client, whereas mutual authentication provides a means for both the client and the server to authenticate each other.

This requirement applies to applications that utilize communications sessions. This includes, but is not limited to, web-based applications and Service-Oriented Architectures (SOA).

This requirement addresses communications protection at the application session, versus the network packet, and establishes grounds for confidence at both ends of communications sessions in ongoing identities of other parties and in the validity of information transmitted. Depending on the required degree of confidentiality and integrity, web services/SOA will require the use of SSL/TLS mutual authentication (two-way/bidirectional).",,"Review the application documentation and configuration.

Interview the application administrator and obtain implementation documentation identifying system architecture.

Identify the application communication paths. This includes system to system communication and client to server communication that transmit session identifiers over the network.

Have the application administrator identify the methods and mechanisms used to protect the application session ID traffic. Acceptable methods include SSL/TLS both one-way and two-way and VPN tunnel.

The protections must be implemented on a point-to-point basis based upon the architecture of the application.

For example; a web application hosting static data will provide SSL/TLS encryption from web client to the web server. More complex designs may encrypt from application server to application server (if applicable) and application server to database as well.

If the session IDs are unencrypted across network segments, this is a finding.",Configure the application to protect session IDs from interception or from manipulation.,,,false,,,,,,,M,Unclass,"Application Security and Development Security Technical Implementation Guide :: Version 4, Release: 11 Benchmark Date: 24 Jul 2020",3009,"CCI-001184
The information system protects the authenticity of communications sessions.
NIST SP 800-53 :: SC-23
NIST SP 800-53A :: SC-23.1
NIST SP 800-53 Revision 4 :: SC-23",SC-23,,One-way TLS encryption is implemented with HTTP Strict Transport Security (HSTS)
V-70207,high,SRG-APP-000220,SV-84829r1_rule,APSC-DV-002240,The application must destroy the session ID value and/or cookie on logoff or browser close.,"Many web development frameworks such as PHP, .NET, and ASP include their own mechanisms for session management. Whenever possible it is recommended to utilize the provided session management framework.

Session cookies contain application session information that can be used to impersonate the web application user or hijack their application session. Once the user's session has terminated, these session IDs must be destroyed and not reused.",,"Review the application documentation and interview the application administrator.

Identify how the application destroys session IDs.

If using a web development framework, ask the application administrator to provide details on the framework's session configuration.

Review framework configuration setting to determine how the session identifiers are destroyed.

Review the client system and using a browser or other tool capable of viewing client cookies, identify cookies set by the application and verify that application session ID cookies are destroyed once the user has logged off or the browser has closed.

If the session IDs and associated cookies are not destroyed on logoff or browser close, this is a finding.",Configure the application to destroy session ID cookies once the application session has terminated.,,,false,,,,,,,M,Unclass,"Application Security and Development Security Technical Implementation Guide :: Version 4, Release: 11 Benchmark Date: 24 Jul 2020",3009,"CCI-001185
The information system invalidates session identifiers upon user logout or other session termination.
NIST SP 800-53 :: SC-23 (1)
NIST SP 800-53A :: SC-23 (1).1
NIST SP 800-53 Revision 4 :: SC-23 (1)",SC-23 (1),,Session token is deleted when logout is performed.
V-70221,high,SRG-APP-000225,SV-84843r1_rule,APSC-DV-002310,"The application must fail to a secure state if system initialization fails, shutdown fails, or aborts fail.","Failure to a known safe state helps prevent systems from failing to a state that may cause loss of data or unauthorized access to system resources. Applications or systems that fail suddenly and with no incorporated failure state planning may leave the hosting system available but with a reduced security protection capability. Preserving information system state information also facilitates system restart and return to the operational mode of the organization with less disruption of mission-essential processes.

In general, application security mechanisms should be designed so that a failure will follow the same execution path as disallowing the operation. For example, security methods, such as isAuthorized(), isAuthenticated(), and validate(), should all return false if there is an exception during processing. If security controls can throw exceptions, they must be very clear about exactly what that condition means.

Abort refers to stopping a program or function before it has finished naturally. The term abort refers to both requested and unexpected terminations.",,"Review application design documentation, vulnerability scanner reports and interview application administrator to identify application components.

The design of the application should account for the following:

- Connections to databases are left open
- Access control mechanisms are disabled
- Data left in temporary locations

Testing application failure will require taking down parts of the application.

Review the vulnerability assessment configuration settings included in vulnerability report.

Examine the application test plans and procedures to determine if this type of failure was previously tested.

If test plans exist, validate the tests by performing a subset of the checks.

If test plans do not exist, an application failure must be simulated.

Simulate a failure. This can be accomplished by stopping the web server service and/or the database service. Also, for applications using web services stop the web service and/or the database.

Check to ensure that application data is still protected. Some examples of tests follow:

- Try to submit SQL queries to the database. Verify that the database requires authentication before returning data.
- Try to read the application source files; access should not be granted to these files because the application is not operating.
- Try to open database files; data should not be available because the application is not operational.

If the application fails in such a way that the application security controls are rendered inoperable, this is a finding.","Fix any vulnerability found when the application is an insecure state (initialization, shutdown and aborts).",,,false,,,,,,,M,Unclass,"Application Security and Development Security Technical Implementation Guide :: Version 4, Release: 11 Benchmark Date: 24 Jul 2020",3009,"CCI-001190
The information system fails to an organization-defined known-state for organization-defined types of failures.
NIST SP 800-53 :: SC-24
NIST SP 800-53A :: SC-24.1 (iv)
NIST SP 800-53 Revision 4 :: SC-24",SC-24,,"The Prisma Cloud Compute Defender is explicitly designed to be survivable even in the case of a prolonged (multi-hour) disconnection from Console.  Defender caches all policy locally, executes actions based on this cached policy, and spools logs locally until connectivity is restored.  Defender will automatically, continuously work to re-establish connectivity and, once accomplished, will automatically re-sync policy and send spooled events."
