Vuln ID,Severity,Group Title,Rule ID,STIG ID,Rule Title,Discussion,IA Controls,Check Content,Fix Text,False Positives,False Negatives,Documentable,Mitigations,Potential Impact,Third Party Tools,Mitigation Control,Responsibility,Severity Override Guidance,Check Content Reference,Classification,STIG,VMS Asset Posture,CCI,NIST SP 800-53 Revision 4 References,Legacy,Prisma Cloud Compute Response
V-69279,high,SRG-APP-000014,SV-83901r1_rule,APSC-DV-000190,Messages protected with WS_Security must use time stamps with creation and expiration times.,"The lack of time stamps could lead to the eventual replay of the message, leaving the application susceptible to replay events which may result in an immediate loss of confidentiality.",,"Ask the application representative for the design document. Review the design document for web services using WS-Security tokens.

If the application does not utilize WS-Security tokens, this check is not applicable.

Examine the contents of a SOAP message using WS Security; all messages should contain time stamps, sequence numbers, and expiration.

If messages using WS Security do not contain time stamps, sequence numbers, and expiration, this is a finding.",Design and configure applications using WS-Security messages to use time stamps with creation and expiration times and sequence numbers.,,,false,,,,,,,M,Unclass,"Application Security and Development Security Technical Implementation Guide :: Version 4, Release: 11 Benchmark Date: 24 Jul 2020",3009,"CCI-000068
The information system implements cryptographic mechanisms to protect the confidentiality of remote access sessions.
NIST SP 800-53 :: AC-17 (2)
NIST SP 800-53A :: AC-17 (2).1
NIST SP 800-53 Revision 4 :: AC-17 (2)",AC-17 (2),,"Console session token has a configurable timeout. By default, the timeout is 1440 minutes (24 hours). This configurable timeout value also controls the validity period for API tokens. https://docs.paloaltonetworks.com/prisma/prisma-cloud/20-04/prisma-cloud-compute-edition-admin/configure/long_lived_tokens.html"
V-69281,high,SRG-APP-000014,SV-83903r1_rule,APSC-DV-000200,Validity periods must be verified on all application messages using WS-Security or SAML assertions.,"When using WS-Security in SOAP messages, the application should check the validity of the time stamps with creation and expiration times. Time stamps that are not validated may lead to a replay event and provide immediate unauthorized access of the application. Unauthorized access results in an immediate loss of confidentiality.",,"Ask the application representative for the design document.

Review the design document for web services.

If the application does not utilize WSS or SAML assertions, this requirement is not applicable.

Review the design document and verify validity periods are checked on all messages using WS-Security or SAML assertions.

If the design document does not exist, or does not indicate validity periods are checked on messages using WS-Security or SAML assertions, this is a finding.","Design and configure the application to use validity periods, ensure validity periods are verified on all WS-Security token profiles and SAML Assertions.",,,false,,,,,,,M,Unclass,"Application Security and Development Security Technical Implementation Guide :: Version 4, Release: 11 Benchmark Date: 24 Jul 2020",3009,"CCI-000068
The information system implements cryptographic mechanisms to protect the confidentiality of remote access sessions.
NIST SP 800-53 :: AC-17 (2)
NIST SP 800-53A :: AC-17 (2).1
NIST SP 800-53 Revision 4 :: AC-17 (2)",AC-17 (2),,Prisma Cloud Compute supports SAML v2.0 federation. SAML assertions must be signed by the IdP and are validated by Prisma Cloud Compute. The IssueInstant value if evaluated.
V-69287,high,SRG-APP-000014,SV-83909r1_rule,APSC-DV-000230,The application must use the NotOnOrAfter condition when using the SubjectConfirmation element in a SAML assertion.,"SAML is a standard for exchanging authentication and authorization data between security domains.  SAML uses security tokens containing assertions to pass information about a principal (usually an end user) between a SAML authority, (identity provider), and a SAML consumer, (service provider).  SAML assertions are usually made about a subject, (user) represented by the <Subject> element.

When a SAML assertion is used with a <SubjectConfirmation> element, a begin and end time for the <SubjectConfirmation> should be set to prevent reuse of the message at a later time. Not setting a specific time period for the <SubjectConfirmation>, may grant immediate access to an attacker and result in an immediate loss of confidentiality.",,"Ask the application representative for the design document.

Review the design document for web services using SAML assertions.

If the application does not utilize SAML assertions, this check is not applicable.

Examine the contents of a SOAP message using the <SubjectConfirmation> element. All messages should contain the <NotOnOrAfter> element. This can be accomplished if the application allows the ability to view XML messages or via a protocol analyzer like Wireshark.

If SOAP messages do not contain <NotOnOrAfter> elements, this is a finding.",Design and configure the application to use the <NotOnOrAfter> condition when using the <SubjectConfirmation> element in a SAML assertion.,,,false,,,,,,,M,Unclass,"Application Security and Development Security Technical Implementation Guide :: Version 4, Release: 11 Benchmark Date: 24 Jul 2020",3009,"CCI-000068
The information system implements cryptographic mechanisms to protect the confidentiality of remote access sessions.
NIST SP 800-53 :: AC-17 (2)
NIST SP 800-53A :: AC-17 (2).1
NIST SP 800-53 Revision 4 :: AC-17 (2)",AC-17 (2),,Prisma Cloud Compute SAML module validates the IdP authentication response’s Condition NotOnOrBefore and NotOnOrAfter assertions.
V-69289,high,SRG-APP-000014,SV-83911r1_rule,APSC-DV-000240,The application must use both the NotBefore and NotOnOrAfter elements or OneTimeUse element when using the Conditions element in a SAML assertion.,"SAML is a standard for exchanging authentication and authorization data between security domains.  SAML uses security tokens containing assertions to pass information about a principal (usually an end user) between a SAML authority, (identity provider), and a SAML consumer, (service provider).  SAML assertions are usually made about a subject, (user) represented by the <Subject> element.

When a SAML assertion is used with a <Conditions> element, a begin and end time for the <Conditions> element should be set in order to specify a timeframe in which the assertion is valid. Not setting a specific time period for the <Conditions> element, the possibility exists of granting immediate access or elevated privileges to an attacker which results in an immediate loss of confidentiality.",,"Ask the application representative for the design document.

Review the design document for web services using SAML assertions.

If the application does not utilize SAML assertions, this check is not applicable.

Examine the contents of a SOAP message using the <Conditions> element; all messages should contain the <NotBefore> and <NotOnOrAfter> or <OneTimeUse> element when in a SAML Assertion. This can be accomplished using a protocol analyzer such as Wireshark.

If SOAP using the <Conditions> element does not contain <NotBefore> and <NotOnOrAfter> or <OneTimeUse> elements, this is a finding.",Design and configure the application to implement the use of the <NotBefore> and <NotOnOrAfter> or <OneTimeUse> when using the <Conditions> element in a SAML assertion.,,,false,,,,,,,M,Unclass,"Application Security and Development Security Technical Implementation Guide :: Version 4, Release: 11 Benchmark Date: 24 Jul 2020",3009,"CCI-000068
The information system implements cryptographic mechanisms to protect the confidentiality of remote access sessions.
NIST SP 800-53 :: AC-17 (2)
NIST SP 800-53A :: AC-17 (2).1
NIST SP 800-53 Revision 4 :: AC-17 (2)",AC-17 (2),,Prisma Cloud Compute SAML module validates the IdP authentication response’s Condition NotOnOrBefore and NotOnOrAfter assertions.
V-69329,high,SRG-APP-000033,SV-83951r1_rule,APSC-DV-000460,The application must enforce approved authorizations for logical access to information and system resources in accordance with applicable access control policies.,"To mitigate the risk of unauthorized access to sensitive information by entities that have been issued certificates by DoD-approved PKIs, all DoD systems (e.g., networks, web servers, and web portals) must be properly configured to incorporate access control methods that do not rely solely on the possession of a certificate for access. 

Successful authentication must not automatically give an entity access to a restricted asset or security boundary.

Authorization procedures and controls must be implemented to ensure each authenticated entity also has a validated and current authorization.

Authorization is the process of determining whether an entity, once authenticated, is permitted to access a specific asset.

Information systems use access control policies and enforcement mechanisms to implement this requirement.

Access control policies include identity-based policies, role-based policies, and attribute-based policies.

Access enforcement mechanisms include access control lists, access control matrices, and cryptography.

These policies and mechanisms must be employed by the application to control access between users (or processes acting on behalf of users) and objects (e.g., devices, files, records, processes, programs, and domains) in the information system.

This requirement is applicable to access control enforcement applications (e.g., authentication servers) and other applications that perform information and system access control functions.",,"Review the application documentation and interview the application administrator.

Review application data protection requirements.

Identify application resources that require protection and authentication over and above the authentication required to access the application itself.

This can be access to a URL, a folder, a file, a process or a database record that should only be available to certain individuals.

Identify the access control methods utilized by the application in order to control access to the resource.

Examples include Role-Based Access Control policies (RBAC).

Using RBAC as an example, utilize a test account placed into a test role.

Set a protection control on a resource and explicitly deny access to the role assigned to the test user account.

Try to access an application resource that is not configured to allow access. Access should be denied.

If the enforcement of configured access restrictions is not performed, this is a finding.",Design or configure the application to enforce access to application resources.,,,false,,,,,,,M,Unclass,"Application Security and Development Security Technical Implementation Guide :: Version 4, Release: 11 Benchmark Date: 24 Jul 2020",3009,"CCI-000213
The information system enforces approved authorizations for logical access to information and system resources in accordance with applicable access control policies.
NIST SP 800-53 :: AC-3
NIST SP 800-53A :: AC-3.1
NIST SP 800-53 Revision 4 :: AC-3",AC-3,,"Prisma Cloud Compute supports assigning roles to users and groups to control their level of access to Prisma Cloud. Roles determine what a user can do and see in Console, and API access. https://docs.paloaltonetworks.com/prisma/prisma-cloud/20-04/prisma-cloud-compute-edition-admin/access_control/user_roles.html"
V-69339,high,SRG-APP-000342,SV-83961r1_rule,APSC-DV-000510,The application must execute without excessive account permissions.,"Applications are often designed to utilize a user account.  The account represents a means to control application permissions and access to OS resources, application resources or both.  

When the application is designed and installed, care must be taken not to assign excessive permissions to the user account that is used by the application.  

An application operating with unnecessary privileges can potentially give an attacker access to the underlying operating system or if the privileges required for application execution are at a higher level than the privileges assigned to organizational users invoking such applications/programs, those users are indirectly provided with greater privileges than assigned by organizations.

Applications must be designed and configured to operate with only those permissions that are required for proper operation.",,"Review the system documentation or interview the application representative and identify if the application utilizes an account in order to operate.

Determine the OS user groups in which each application account is a member.  List the user rights assigned to these users and groups using relevant OS commands and evaluate whether any of them provide admin rights or if they are unnecessary or excessive. 

If the application connects to a database, open an admin console to the database and view the database users, their roles and group rights.

Locate the application user account used to access the database and examine the accounts privileges. This includes group privileges.

If the application user account has excessive OS privileges such as being in the admin group, database privileges such as being in the DBA role, has the ability to create, drop, alter the database (not application database tables), or if the application user account has other excessive or undefined system privileges, this is a finding.",Configure the application accounts with minimalist privileges. Do not allow the application to operate with admin credentials.,,,false,,,,,,,M,Unclass,"Application Security and Development Security Technical Implementation Guide :: Version 4, Release: 11 Benchmark Date: 24 Jul 2020",3009,"CCI-002233
The information system prevents organization-defined software from executing at higher privilege levels than users executing the software.
NIST SP 800-53 Revision 4 :: AC-6 (8)",AC-6 (8),,"Prisma Cloud Compute Console and Defender(s) run as containers within your microservices environment. The Console can be configured to run under the “twistlock” account (non-root). The Defender Defender container run as root, further explanation can be found here: https://docs.paloaltonetworks.com/prisma/prisma-cloud/20-04/prisma-cloud-compute-edition-admin/technology_overviews/defender_architecture.html"
V-69343,high,SRG-APP-000065,SV-83965r1_rule,APSC-DV-000530,The application must enforce the limit of three consecutive invalid logon attempts by a user during a 15 minute time period.,"By limiting the number of failed logon attempts, the risk of unauthorized system access via user password guessing, otherwise known as brute forcing, is reduced.

Limits are imposed by locking the account.

User notification when three failed logon attempts are exceeded is an operational consideration determined by the application owner. In some instances the operational situation may dictate that no notice is to be provided to the user when their account is locked. In other situations, the user may be notified their account is now locked. This decision is left to the application owner based upon their operational scenarios.",,"All testing must be performed within a 15-minute window.

Log on to the application with a test user account.

Intentionally enter an incorrect user password or pin.

Repeat 2 times within 15 minutes for a total of three failed attempts.

Notification of a locked account may or may not be provided.

Using the correct user password or pin, attempt to logon a 4th time.

If the logon is successful upon the 4th attempt the account was not locked after the third failed attempt and this is a finding.",Configure the application to enforce an account lock after 3 failed logon attempts occurring within a 15-minute window.,,,false,,,,,,,M,Unclass,"Application Security and Development Security Technical Implementation Guide :: Version 4, Release: 11 Benchmark Date: 24 Jul 2020",3009,"CCI-000044
The information system enforces the organization-defined limit of consecutive invalid logon attempts by a user during the organization-defined time period.
NIST SP 800-53 :: AC-7 a
NIST SP 800-53A :: AC-7.1 (ii)
NIST SP 800-53 Revision 4 :: AC-7 a",AC-7 a,,"Prisma Cloud Compute username/password authentication does not enforce a password brute force account lock out. Username/password authentication can be disabled and password brute force protections can be applied via a 3rd party authentications source (e.g. LDAP, SAML, X.509). All authentication attempts are logged. Direct X.509 (DoD CAC) authentication is supported."
V-69527,high,SRG-APP-000148,SV-84149r1_rule,APSC-DV-001540,The application must uniquely identify and authenticate organizational users (or processes acting on behalf of organizational users).,"To assure accountability and prevent unauthenticated access, organizational users must be identified and authenticated to prevent potential misuse and compromise of the system.

Organizational users include organizational employees or individuals the organization deems to have equivalent status of employees (e.g., contractors). 

Organizational users (and any processes acting on behalf of users) must be uniquely identified and authenticated for all accesses, except the following:

(i) Accesses explicitly identified and documented by the organization. Organizations document specific user actions that can be performed on the information system without identification or authentication; and 
(ii) Accesses that occur through authorized use of group authenticators without individual authentication. Organizations may require unique identification of individuals in group accounts (e.g., shared privilege accounts) or for detailed accountability of individual activity.",,"Review the application documentation and interview the application administrator to determine how organizational users access the application.

If the application is publicly available, providing access to publicly releasable data and the users are non-organizational users such as individuals who no longer have a CAC (e.g., retirees) or  members of the public with no requirement for DoD credentials, this requirement is not applicable.

The requirement still applies to DoD organizational users and admins when accessing the non-public data areas or system resources of the system.

Attempt to access the application and confirm that a unique user account and password or CAC token and pin are required in order to access the application.

If the application does not uniquely identify and authenticate users, this is a finding.",Configure the application to uniquely identify and authenticate users and user processes.,,,false,,,,,,,M,Unclass,"Application Security and Development Security Technical Implementation Guide :: Version 4, Release: 11 Benchmark Date: 24 Jul 2020",3009,"CCI-000764
The information system uniquely identifies and authenticates organizational users (or processes acting on behalf of organizational users).
NIST SP 800-53 :: IA-2
NIST SP 800-53A :: IA-2.1
NIST SP 800-53 Revision 4 :: IA-2",IA-2,,"All account creation, maintenance, deletion and role assignment is the responsibility of the Prisma Cloud Compute Administrator(s). There are no built-in local accounts. Prisma Cloud Compute can be integrated with 3rd party authentication stores that implement an organization’s approved identity management policies and procedures. Role assignment can get associated with the identity provider’s group assignments. Direct X.509 (DoD CAC) authentication is supported."
V-69555,high,SRG-APP-000164,SV-84177r1_rule,APSC-DV-001680,The application must enforce a minimum 15-character password length.,"The shorter the password, the lower the number of possible combinations that need to be tested before the password is compromised.

Use of passwords for application authentication is intended only for limited situations and should not be used as a replacement for two-factor CAC-enabled authentication.

Examples of situations where a user ID and password might be used include but are not limited to:

- When the application user base does not have a CAC and is not a current DoD employee, member of the military, or a DoD contractor.

- When an application user has been officially designated as a Temporary Exception User; one who is temporarily unable to present a CAC for some reason (lost, damaged, not yet issued, broken card reader) and to satisfy urgent organizational needs must be temporarily permitted to use user ID/password authentication until the problem with CAC use has been remedied.

and

- When the application is publicly available and or hosting publicly releasable data requiring some degree of need-to-know protection.

Password complexity, or strength, is a measure of the effectiveness of a password in resisting attempts at guessing and brute-force attacks. Password length is one factor of several that helps to determine strength and how long it takes to crack a password. The shorter the password, the lower the number of possible combinations that need to be tested before the password is compromised.

Use of more characters in a password helps to exponentially increase the time and/or resources required to compromise the password.",,"Review the application documentation and interview the application administrator to identify if the application uses passwords for user authentication.

If the application does not use passwords, the requirement is not applicable.

Access the application management interface and create a test user account or logon to the system with a test account and access the functionality that provides password change capabilities.

When prompted to provide the password, attempt to create a password shorter than 15 characters in length.

If a password shorter than 15 characters can be created, this is a finding.",Configure the application to require 15 characters in the password.,,,false,,,,,,,M,Unclass,"Application Security and Development Security Technical Implementation Guide :: Version 4, Release: 11 Benchmark Date: 24 Jul 2020",3009,"CCI-000205
The information system enforces minimum password length.
NIST SP 800-53 :: IA-5 (1) (a)
NIST SP 800-53A :: IA-5 (1).1 (i)
NIST SP 800-53 Revision 4 :: IA-5 (1) (a)",IA-5 (1) (a),,"Prisma Cloud Compute can enforce the use of a strong password: cannot be the same as the username, must be at least 12 characters, must contain one of each of the following: uppercase character, lowercase character, number, special character. List of special characters: ~!@#$%^&*()-_=+|[{}];:’\”,<.>/?"" For 15 character password use 3rd party authentication (LDAP, SAML). Direct X.509 (DoD CAC) authentication is supported."
