V-70293,high,ASDV-PL-002890,SV-84915r1_rule,APSC-DV-002890,Application web servers must be on a separate network segment from the application and database servers if it is a tiered application operating in the DoD DMZ.,"A tiered application usually consists of 3 tiers, the web layer (presentation tier), the application layer (application logic tier), and the database layer (data storage tier).

Using one system for hosting all 3 tiers introduces risk that if one tier is compromised, there are no additional protection layers available to defend the other tiers.
Security controls must be in place in order to provide different levels and types of defenses for each type of server based upon data protection requirements identified by policy or data owner.

DoD DMZ policy specifies that logical separation is allowed but when hosting different data types on the same server, physical separation is required.

1) Unrestricted web servers and Restricted web servers must be on separate virtual or physical servers from Private web servers, application servers, or database servers.
2) Unrestricted web servers and Restricted web servers can either be on separate physical servers from each other, or they can be on separate virtual servers.
3) If application and database servers have been separated by service type into Unrestricted, Restricted, and Private servers (permitted but not required in Increment 1 Phase 1), they must be on separate virtual or physical servers from each other by server type (Application or Database) and by service type (Unrestricted, Restricted, or Private).

Reference the DoD DMZ STIG for details on data types and separation requirements.

Security controls include firewalls or other forms of access controls that restrict the ability to traverse the network from one system to the other.

Separation can be performed either physically or logically based upon data protection and application protection design requirements.

Physically separate networks require distinct physical network devices for connections (e.g., two separate switches or two separate routers).

Physically separate machines utilize a non-virtual OS.

Logically separate networks are usually implemented via a VLAN.

Logically separate systems are implemented with virtual machines or other system emulation.

Security controls are firewall rules or ACLs that provide access restrictions on network traffic and limit communications between systems to only application and application/system support traffic.

For complete explanation of DoD DMZ requirements, reference DoD DMZ requirements.",,"Review the application documentation.

Review the application data protection requirements and identify if all data types hosted on server are identical.

Review the network diagram and identify web servers/web services, web application servers, and database servers.

If the application is not hosted in the DoD DMZ, this requirement is not applicable.

Verify the application web servers are separated from the application and database servers if the application is a tiered design as per DoD DMZ STIG requirements.

If the application is tiered and the network infrastructure hosting the application is not configured to provide separation and security access controls between the tiered layers in accordance with DoD DMZ requirements, this is a finding.",Separate web server from other application tiers and place it on a separate network segment apart from the application and database servers in accordance with DoD DMZ data access controls requirements.,,,false,,,,,,,M,Unclass,"Application Security and Development Security Technical Implementation Guide :: Version 4, Release: 11 Benchmark Date: 24 Jul 2020",3009,"CCI-002225
The information system provides separate processing domains to enable finer-grained allocation of user privileges.
NIST SP 800-53 Revision 4 :: AC-6 (4)",AC-6 (4),,Prisma Cloud Compute is a containerized micro serviced solution. The architecture is based upon  two containers (Console & Defender). One Console command and controls multiple Defenders. The Console runs as a container and hosts the web based UI and API. The database is created within the local filesystem of the container (PersistentVolume). The Defender is a “lights-out” container that has no user interaction. It receives all policies from its controlling Console. The Defender does not store any persistent data. All data is communicated back to the controlling Console.
V-70363,high,ASDV-PL-003110,SV-84985r1_rule,APSC-DV-003110,The application must not contain embedded authentication data.,Authentication data stored in code could potentially be read and used by anonymous users to gain access to a backend database or application servers. This could lead to compromise of application data.,,"Review the application documentation and any available source code; this includes configuration files such as global.asa, if present, scripts, HTML files, and any ASCII files.

Identify any instances of passwords, certificates, or sensitive data included in code.

If credentials were found, check the file permissions and ownership of the offending file.

If access to the folder hosting the file is not restricted to the related application process and administrative users, this is a finding.

The finding details should note specifically where the offending credentials or data were located and what resources they enabled.","Remove embedded authentication data stored in code, configuration files, scripts, HTML file, or any ASCII files.",,,false,,,,,,,M,Unclass,"Application Security and Development Security Technical Implementation Guide :: Version 4, Release: 11 Benchmark Date: 24 Jul 2020",3009,"CCI-002367
The organization ensures unencrypted static authenticators are not embedded in applications.
NIST SP 800-53 Revision 4 :: IA-5 (7)",IA-5 (7),,There are no built-in local accounts.
V-70365,high,ASDV-PL-003120,SV-84987r1_rule,APSC-DV-003120,The application must have the capability to mark sensitive/classified output when required.,Failure to properly mark output could result in a disclosure of sensitive or classified data which is an immediate loss in confidentiality.,,"Review the application documentation and interview the application administrator.

Ask the application representative for the application’s classification guide. This guide should document the data elements and their classification.

Determine which application functions to examine, giving preference to report generation capabilities and the most common user transactions that involve sensitive data (FOUO, secret or above).

Log on to the application and perform these in sequence, printing output when applicable. The application representative’s assistance may be required to perform these steps. For each function, note whether the appropriate markings appear on the displayed and printed output. If a classification document does not exist, data must be marked at the highest classification of the system.

Appropriate markings for an application are as follows: For classified data, markings are required at a minimum at the top and the bottom of screens and reports.

For FOUO data, markings are required at a minimum of the bottom of the screen or report. In some cases, technology may prohibit the appropriate markings on printed documents. For example, in some cases, it is not possible to mark all pages top and bottom when a user prints from a browser. If this is the case, ask the application representative if user procedures exist for manually marking printed documents. If procedures do exist, examine the procedures to verify if the users were to follow the procedures the data would be marked correctly.

Ask how these procedures are distributed to the users.

If appropriate markings are not present within the application and it is technically possible to have the markings present, this is a finding.

If it is not technically feasible to meet the minimum marking requirement and no user procedures exist or if followed the procedures will result in incorrect markings, or the procedures are not readily available to users, this is a finding.

In any case of a finding, the finding details should specify which functions failed to produce the desired results.

After completing the test, destroy all printed output using the site’s preferred method for disposal. For example: utilizing a shredder or disposal in burn bags.",Enable the application to adequately mark sensitive/classified output.,,,false,,,,,,,M,Unclass,"Application Security and Development Security Technical Implementation Guide :: Version 4, Release: 11 Benchmark Date: 24 Jul 2020",3009,"CCI-001010
The organization marks information system media indicating the distribution limitations, handling caveats, and applicable security markings (if any) of the information.
NIST SP 800-53 :: MP-3 a
NIST SP 800-53A :: MP-3.1 (ii)
NIST SP 800-53 Revision 4 :: MP-3 a",MP-3 a,,Prisma Cloud Compute can run in any environment that supports microservices regardless of classification levels. No data is exported from the system unless performed by the administrator. It is the administrators responsibility to handle the exported data to the classification level of the environment that Prisma Cloud Compute is deployed.
V-70395,high,ASDV-PL-003240,SV-85017r2_rule,APSC-DV-003240,All products must be supported by the vendor or the development team.,Unsupported commercial and government developed software products should not be used because fixes to newly identified bugs will not be implemented by the vendor or development team. The lack of security updates can result in potential vulnerabilities.,,"Review the application documentation and interview the application administrator.

Identify all software components.

Review the version information and identify the vendor if COTS software.

Access the vendor website to verify the version is still supported.

Ask the application representative for proof that the application and all of its components are supported.

Examples of proof may include:

design documentation that includes support information, support specific contract documentation, successful creation of vendor support tickets, website toll free support phone numbers etcetera.

If any of the software components are not supported by a COTS vendor or a GOTS organization, this is a finding.",Remove or decommission all unsupported software products in the application.,,,false,,,,,,,M,Unclass,"Application Security and Development Security Technical Implementation Guide :: Version 4, Release: 11 Benchmark Date: 24 Jul 2020",3009,"CCI-003376
The organization replaces information system components when support for the components is no longer available from the developer, vendor, or manufacturer.
NIST SP 800-53 Revision 4 :: SA-22 a",SA-22 a,,Prisma Cloud Compute is a fully supported product from Palo Alto Networks. Product documentation can be found here: https://docs.paloaltonetworks.com/prisma/prisma-cloud/20-04/prisma-cloud-compute-edition-admin/welcome/getting_started.html
V-70397,high,ASDV-PL-003250,SV-85019r1_rule,APSC-DV-003250,The application must be decommissioned when maintenance or support is no longer available.,"Unsupported software products should not be used because fixes to newly identified bugs will not be implemented by the vendor or development team. The lack of security updates can result in potential vulnerabilities.

When maintenance updates and patches are no longer available, the application is no longer considered supported, and should be decommissioned.",,"Interview the application representative and determine if all the application components are under maintenance contract. The entire application may be covered by a single maintenance agreement. The application should be decommissioned if maintenance or security support is no longer being provided by the vendor or by the development staff of a custom developed application.

If the application or any of the application components are not being maintained, this is a finding.",Ensure there is maintenance for the application.,,,false,,,,,,,M,Unclass,"Application Security and Development Security Technical Implementation Guide :: Version 4, Release: 11 Benchmark Date: 24 Jul 2020",3009,"CCI-003376
The organization replaces information system components when support for the components is no longer available from the developer, vendor, or manufacturer.
NIST SP 800-53 Revision 4 :: SA-22 a",SA-22 a,,Palo Alto Networks supports n-1 of the major releases of Prisma Cloud Compute. Major versions (features) are released every quarter. Minor versions (bug fix and vulnerabilities remediation) are released durning a Major release’s lifecycle.
V-70403,high,ASDV-PL-003280,SV-85025r1_rule,APSC-DV-003280,Default passwords must be changed.,Default passwords can easily be compromised by attackers allowing immediate access to the applications.,,"Identify the application name and version and do an Internet search for the product name and the string ""default password"".

If default passwords are found, attempt to authenticate with the published default passwords.

If authentication is successful, this is a finding.","Configure the application to use strong authenticators instead of passwords when possible. Otherwise, change default passwords to a DoD-approved strength password and follow all guidance for passwords.",,,false,,,,,,,M,Unclass,"Application Security and Development Security Technical Implementation Guide :: Version 4, Release: 11 Benchmark Date: 24 Jul 2020",3009,"CCI-003109
The organization requires the developer of the information system, system component, or information system service to deliver the system, component, or service with organization-defined security configurations implemented.
NIST SP 800-53 Revision 4 :: SA-4 (5) (a)",SA-4 (5) (a),,"There are no built-in local accounts. Local username/password do not expire. It is recommended to disable username/password authentication and authentication can be provided by a 3rd party authentications source (e.g. LDAP, SAML, X.509). Direct X.509 (DoD CAC) authentication is supported."
