V-70245,high,SRG-APP-000439,SV-84867r1_rule,APSC-DV-002440,The application must protect the confidentiality and integrity of transmitted information.,"Without protection of the transmitted information, confidentiality and integrity may be compromised since unprotected communications can be intercepted and either read or altered.

This requirement applies  to those applications that transmit data, or allow access to data non-locally. Application and data owners have a responsibility for ensuring data integrity and confidentiality is maintained at every step of the data transfer and handling process. 

Application and data owners need to identify the data that requires cryptographic protection. If no data protection requirements are defined as to what specific data must be encrypted and what data is non-sensitive and doesn't require encryption, all data must be encrypted.
 
When transmitting data, applications need to leverage transmission protection mechanisms, such as TLS, SSL VPNs, or IPSEC.

Communication paths outside the physical protection of a controlled boundary are exposed to the possibility of interception and modification. Protecting the confidentiality and integrity of organizational information can be accomplished by physical means (e.g., employing physical distribution systems) or by logical means (e.g., employing cryptographic techniques). If physical means of protection are employed, then logical means (cryptography) do not have to be employed, and vice versa.",,"Review the application documentation and interview the application administrator.

Identify application clients, servers and associated network connections including application networking ports.  

Identify the types of data processed by the application and review any documented data protection requirements.

Identify the application communication protocols.

Review application documents for instructions or guidance on configuring application encryption settings.

Verify the application is configured to enable encryption protections for data in accordance with the data protection requirements. If no data protection requirements exist, ensure all application data is encrypted.

If the application does not utilize TLS, IPsec or other approved encryption mechanism to protect the confidentiality and integrity of transmitted information, this is a finding.",Configure all of the application systems to require TLS encryption in accordance with data protection requirements.,,,false,,,,,,,M,Unclass,"Application Security and Development Security Technical Implementation Guide :: Version 4, Release: 11 Benchmark Date: 24 Jul 2020",3009,"CCI-002418
The information system protects the confidentiality and/or integrity of transmitted information.
NIST SP 800-53 Revision 4 :: SC-8",SC-8,,All communication between the Prisma Cloud Compute Console and associated deployed Defenders is TCP based and protected by a mutually authenticated X.509 TLS session.
V-70255,high,SRG-APP-000441,SV-84877r1_rule,APSC-DV-002485,The application must not store sensitive information in hidden fields.,"Hidden fields allow developers to process application data without having to display it on the screen.  Using hidden fields to pass data in forms is a common practice among web applications and by itself is not a security risk.  

However, hidden fields are not secure and can be easily manipulated by users.  Information requiring confidentiality or integrity protections must not be placed in a hidden field.   If data that is sensitive must be stored in a hidden field, it must be encrypted.

Furthermore, hidden fields used to control access decisions can lead to a complete compromise of access control mechanisms allowing immediate compromise of the user's application session.",,"Interview application administrator and review application documentation to identify and familiarize with the application features and functions.

Request most recent code review and vulnerability scan results.  Review test configuration to ensure testing for hidden fields was conducted.  Review test results for incidents of hidden data fields.  

Examine identified hidden fields and determine what type of data is stored in the hidden fields.

If the data stored in the hidden fields are determined to be authentication or session related data, or if the code review or vulnerability scan results are not available and configured to test for hidden fields, this is a finding.","Design and configure the application to not store sensitive information in hidden fields.  

Encrypt sensitive information stored in hidden fields using DoD-approved encryption and use server side session management techniques for user session management.",,,false,,,,,,,M,Unclass,"Application Security and Development Security Technical Implementation Guide :: Version 4, Release: 11 Benchmark Date: 24 Jul 2020",3009,"CCI-002420
The information system maintains the confidentiality and/or integrity of information during preparation for transmission.
NIST SP 800-53 Revision 4 :: SC-8 (2)",SC-8 (2),,There are no hidden fields in the UI. The UI is built upon the REST API which is fully documented here: https://docs.paloaltonetworks.com/prisma/prisma-cloud/20-04/prisma-cloud-compute-edition-admin/api.html
V-70257,high,SRG-APP-000251,SV-84879r1_rule,APSC-DV-002490,The application must protect from Cross-Site Scripting (XSS) vulnerabilities.,"XSS attacks are essentially code injection attacks against the various language interpreters contained within the browser. XSS can be executed via HTML, JavaScript, VBScript, ActiveX; essentially any scripting language a browser is capable of processing.

XSS vulnerabilities are created when a website does not properly sanitize, escape, or encode user input. For example, ""<;"" is the HTML encoding for the ""<"" character. If the encoding is performed, the script code will not execute.

There are 3 parties involved in an XSS attack, the attacker, the trusted and vulnerable website, and the victim. An attacker will take advantage of a vulnerable website that does not properly validate user input by inserting malicious code into any data entry field.

When the victim visits the trusted website and clicks on the malicious link left by the attacker, the attacker’s script is executed in the victims browser with the trust permissions assigned to the site.

There are several different types of XSS attack and the complete details regarding XSS cannot be described completely here.

To address the issue of XSS, web application developers must escape, encode or otherwise validate all user input that is processed and output by the web server. They should also use web templates or a web development framework that provides the capability to encode or otherwise validate user input.

Examples of XSS vulnerabilities can be obtained from the Open Web Application Security Project (OWASP) website.
  
The site is available by pointing your browser to https://www.owasp.org.",,"Review the application documentation and the vulnerability assessment scan results from automated vulnerability assessment tools.

Verify scan configuration settings include web-based applications settings which include XSS tests.
 
Review scan results for XSS vulnerabilities.

If the scan results indicate aspects of the application are vulnerable to XSS, request subsequent scan data that shows the XSS vulnerabilities previously detected have been fixed.

If results that show compliance are not available, request proof of any steps that have been taken to mitigate the risk. This can include using network-based IPS to detect and prevent XSS attacks from occurring.

If scan results are not available, perform manual testing in various data entry fields to determine if XSS exist.

Navigate through the web application as a regular user and identify any data entry fields where data can be input.

Input the following strings:

<script>alert('hello')</script>
<img src=x onerror=""alert(document.cookie);""

If the script pop up box is displayed, or if scan reports show unremediated XSS results and no mitigating steps have been taken, this is a finding.","Verify user input is validated and encode or escape user input to prevent embedded script code from executing.

Develop your application using a web template system or a web application development framework that provides auto escaping features rather than building your own escape logic.",,,false,,,,,,,M,Unclass,"Application Security and Development Security Technical Implementation Guide :: Version 4, Release: 11 Benchmark Date: 24 Jul 2020",3009,"CCI-001310
The information system checks the validity of organization-defined inputs.
NIST SP 800-53 :: SI-10
NIST SP 800-53A :: SI-10.1
NIST SP 800-53 Revision 4 :: SI-10",SI-10,,Each release of Prisma Cloud Compute has a security assessment performed. If XSS vulnerabilities are identified they are remediated before release.
V-70261,high,SRG-APP-000251,SV-84883r1_rule,APSC-DV-002510,The application must protect from command injection.,"A command injection attack is an attack on a vulnerable application where improperly validated input is passed to a command shell setup in the application. The result is the ability of an attacker to execute OS commands via the application.

A command injection allows an attacker to execute their own commands with the same privileges as the application executing.

The following is an example of a URL based command injection attack.

Before alteration:
\http://sitename/cgi-bin/userData.pl?doc=user1.txt

Example URL modified: 
\http://sitename/cgi-bin/userData.pl?doc=/bin/ls|

The result is the execution of the command “/bin/ls” which could allow the attacker to list contents of the directory via the browser.

The following is a list of functions vulnerable to command injection sorted according to language.  

Language Functions/Characters
- C/C++  - system(), popen(), execlp(), execvp(), ShellExecute(), ShellExecuteEx(), _wsystem()
- Perl - system, exec, `,open, |, eval, /e
- Python - exec, eval, os.system, os.popen, execfile, input, compile
- Java - Class.forName(), Class.newInstance(), Runtime.exec()",,"Review the application documentation and the system configuration settings.

Interview the application administrator for details regarding security assessment including automated code review and vulnerability scans conducted to test for command injection.

Review the scan results from the entire application.

Verify scan configuration is set to check for command injection vulnerabilities.

If results indicate vulnerability, verify a subsequent scan has been run to ensure the issue has been remediated.

Manual test procedures are available on the OWASP website. Procedures may need to be modified to suit application architecture.

https://www.owasp.org/index.php/Testing_for_Command_Injection_%28OTG-INPVAL-013%29

If testing results are not provided demonstrating the vulnerability does not exist, or if the application representative cannot demonstrate how actions are taken to identify and protect from command injection vulnerabilities, this is a finding.",Modify the application so as to escape/sanitize special character input or configure the system to protect against command injection attacks based on application architecture.,,,false,,,,,,,M,Unclass,"Application Security and Development Security Technical Implementation Guide :: Version 4, Release: 11 Benchmark Date: 24 Jul 2020",3009,"CCI-001310
The information system checks the validity of organization-defined inputs.
NIST SP 800-53 :: SI-10
NIST SP 800-53A :: SI-10.1
NIST SP 800-53 Revision 4 :: SI-10",SI-10,,All input to the application is via the REST API. All input (POST & GET) is validated.
V-70267,high,SRG-APP-000251,SV-84889r1_rule,APSC-DV-002540,The application must not be vulnerable to SQL Injection.,"SQL Injection is a code injection attack against database applications. Malicious SQL statements are inserted into an application data entry field where they are submitted to the database and executed. This is a direct result of not validating input that is used by the application to perform a command or execute an action.

Successful attacks can read data, write data, execute administrative functions within the database, shutdown the DBMS, and in some cases execute OS commands.

Best practices to reduce the potential for SQL Injection vulnerabilities include:

Not using concatenation or replacement to build SQL queries.

Using prepared statements with parameterized queries that have been tested and validated not to be vulnerable to SQL Injection.

Using stored procedures that have been tested and validated not to be vulnerable to SQL Injection.

Escaping all user supplied input.

Additional steps to prevent SQL Injection can be found at the OWASP website:

https://www.owasp.org/index.php/SQL_Injection_Prevention_Cheat_Sheet",,"Review the application documentation and interview the application administrator.

Request the latest vulnerability scan test results.

Verify the scan configuration is configured to test for SQL injection flaws.

Review the scan results to determine if any SQL injection flaws were detected during application testing.

If SQL injection flaws were discovered, request a subsequent scan that will show that the issues have been remediated.

If the scan results are not available, identify the database product in use and refer to the OWASP web application testing guide for detailed instructions on performing a manual SQL injection test. The instructions are located here and many tests are organized by database product:

https://www.owasp.org/index.php/Testing_for_SQL_Injection_%28OTG-INPVAL-005%29

If the application is vulnerable to SQL injection attack, contains SQL injection flaws, or if scan results do not exist, this is a finding.",Modify the application and remove SQL injection vulnerabilities.,,,false,,,,,,,M,Unclass,"Application Security and Development Security Technical Implementation Guide :: Version 4, Release: 11 Benchmark Date: 24 Jul 2020",3009,"CCI-001310
The information system checks the validity of organization-defined inputs.
NIST SP 800-53 :: SI-10
NIST SP 800-53A :: SI-10.1
NIST SP 800-53 Revision 4 :: SI-10",SI-10,,Each release of Prisma Cloud Compute has a security assessment performed. If SQL injection vulnerabilities are identified they are remediated before release.
V-70269,high,SRG-APP-000251,SV-84891r1_rule,APSC-DV-002550,The application must not be vulnerable to XML-oriented attacks.,"Extensible Markup Language (XML) is widely employed in web technology and applications like web services (SOAP, REST, and WSDL) and is also used for configuration files. XML vulnerability examples include XML injection, XML Spoofing, XML-based Denial of Service attacks and information disclosure attacks.

When utilizing XML, web applications must take steps to ensure they are addressing XML-related security issues. This is accomplished by choosing well-designed application components, building application code that follows security best practices and by patching application components when vulnerabilities are identified.

XML firewalls or gateways may be employed to assist in protecting applications by controlling access to XML-based applications, filtering XML content, rate-limiting requests, and validating XML traffic.",,"Review the application documentation, the application architecture and interview the application administrator.

Identify any XML-based web services or XML functionality performed by the application.

Determine if an XML firewall is deployed to protect application from XML-related attacks.

If the application does not process XML, the requirement is not applicable.

Review the latest application vulnerability assessment and verify the scan was configured to test for XML-related vulnerabilities and security issues.

Examples include but are not limited to:

XML Injection
XML related Denial of Service
XPATH injection
XML Signature attacks
XML Spoofing

If an XML firewall is deployed, request configuration information regarding the application and validate the firewall is configured to protect the application.

If the vulnerability scan is not configured to scan for XML-oriented vulnerabilities, if no scan results exist, or if the XML firewall is not configured to protect the application, this is a finding.","Design the application to utilize components that are not vulnerable to XML attacks.

Patch the application components when vulnerabilities are discovered.",,,false,,,,,,,M,Unclass,"Application Security and Development Security Technical Implementation Guide :: Version 4, Release: 11 Benchmark Date: 24 Jul 2020",3009,"CCI-001310
The information system checks the validity of organization-defined inputs.
NIST SP 800-53 :: SI-10
NIST SP 800-53A :: SI-10.1
NIST SP 800-53 Revision 4 :: SI-10",SI-10,,All input/output to the application is via the REST API in JSON format. No XML is used.
V-70271,high,SRG-APP-000447,SV-84893r1_rule,APSC-DV-002560,The application must not be subject to input handling vulnerabilities.,"A common application vulnerability is unpredictable behavior due to improper input validation. This requirement guards against adverse or unintended system behavior caused by invalid inputs, where information system responses to the invalid input may be disruptive or cause the system to fail into an unsafe state.

Data received from the user should always be suspected as being malicious and always validated prior to using it as input to the application.

Some examples of input methods:

- Forms Data
- URL parameters
- Hidden Fields
- Cookies
- HTTP Headers or anything in the HTTP request
- Client data entry fields

Items to validate:

- Out of range values/Boundary 
- Data length 
- Validate types of characters allowed
- Whitelist validation for known good data input while denying all other input.

Other recommendations include: 

- Using drop down menus for lists
- Validating input on the server, not on the client.

If validating on the client, also validate on the server:

- Using regular expressions to validate input
- Using HTML filter libraries that implement input validation tasks.",,"Review the application documentation and interview the application administrator.

If working with the developer, request documentation on their development processes and what their standard operating procedure is for sanitizing all application input.

Identify the latest vulnerability scan results.

Review the scan results and scan configuration settings.

Verify the scan was configured to identify input validation vulnerabilities.

If the scan results detected high risk vulnerabilities, verify a more recent scan shows remediation of the vulnerabilities is available for examination.

Review any risk acceptance documentation that indicates the ISSO has reviewed and accepted the risk.

If the vulnerability scan is not configured to test for input validation vulnerabilities if the most recent scan results show that high risk input validation vulnerabilities exist and a documented risk acceptance from the ISSO is not available, or if the scan results do not exist, this is a finding.","Follow best practice when accepting user input and verify that all input is validated before the application processes the input.

Remediate identified vulnerabilities and obtain documented risk acceptance for those issues that cannot be remediated immediately.",,,false,,,,,,,M,Unclass,"Application Security and Development Security Technical Implementation Guide :: Version 4, Release: 11 Benchmark Date: 24 Jul 2020",3009,"CCI-002754
The information system behaves in a predictable and documented manner that reflects organizational and system objectives when invalid inputs are received.
NIST SP 800-53 Revision 4 :: SI-10 (3)",SI-10 (3),,All input to the application is via the REST API. All input (POST & GET) is validated.
V-70277,high,SRG-APP-000450,SV-84899r1_rule,APSC-DV-002590,The application must not be vulnerable to overflow attacks.,"A buffer overflow occurs when a program exceeds the amount of data allocated to a buffer. The buffer is a sequential section of memory and when the data is written outside the memory bounds, the program can crash or malicious code can be executed.

Security safeguards employed to protect memory include, for example, data execution prevention and address space layout randomization. Data execution prevention safeguards can either be hardware-enforced or software-enforced with hardware providing the greater strength of mechanism.

Buffer overflows can manifest as stack overflows, heap overflows integer overflows and format string overflows. Each type of overflow is dependent upon the underlying application language and the context in which the overflow is executed.

Integer overflows can lead to infinite looping when loop index variables are compromised and cause a denial of service.  If the integer is used in data references, the data can become corrupt. Also, using the integer in memory allocation can cause buffer overflows, and a denial of service.  Integers used in access control mechanisms can potentially trigger buffer overflows, which can be used to execute arbitrary code. 

Almost all known web servers, application servers, and web application environments are susceptible to buffer overflows. Proper validation of user input is required to mitigate the risk. Notably, limiting the size of the strings a user is allowed to input to a program to a predetermined, acceptable length.

A code review, static code analysis or active vulnerability or fuzz testing are methods used to identify overflows within application code.",,"Review the application documentation and architecture.

Interview the application admin and identify the most recent code testing and analysis that has been conducted.

Review the test results; verify configuration of analysis tools are set to check for the existence of overflows.  This includes but is not limited to buffer overflows, stack overflows, heap overflows, integer overflows and format string overflows.

If overflows are identified in the test results, verify the latest test results are being used, if not, ensure remediation has been completed.

If the test results show overflows exist and no remediation evidence is presented, or if test results are not available, this is a finding.","Design the application to use a language or compiler that performs automatic bounds checking.

Use an abstraction library to abstract away risky APIs.

Use compiler-based canary mechanisms such as StackGuard, ProPolice, and the Microsoft Visual Studio/GS flag.

Use OS-level preventative functionality and control user input validation.

Patch applications when overflows are identified in vendor products.",,,false,,,,,,,M,Unclass,"Application Security and Development Security Technical Implementation Guide :: Version 4, Release: 11 Benchmark Date: 24 Jul 2020",3009,"CCI-002824
The information system implements organization-defined security safeguards to protect its memory from unauthorized code execution.
NIST SP 800-53 Revision 4 :: SI-16",SI-16,,All input to the application is via the REST API. All input (POST & GET) is validated.
